{
  "@context": "https://mif-spec.dev/schema/context.jsonld",
  "@id": "urn:mif:7e9154a1-3c46-58e9-ba91-56277c823345",
  "aliases": [
    "urn:mif:concept:harness/example-okf-mif-knowledge-spine:trajectory-llm-wiki-karpathy-adoption"
  ],
  "@type": "Concept",
  "citations": [
    {
      "@type": "Citation",
      "accessed": "2026-06-28",
      "citationRole": "supports",
      "citationType": "documentation",
      "title": "LLM Wiki — Karpathy GitHub Gist (April 2026)",
      "url": "https://gist.github.com/karpathy/442a6bf555914893e9891c11519de94f"
    },
    {
      "@type": "Citation",
      "accessed": "2026-06-28",
      "citationRole": "supports",
      "citationType": "article",
      "title": "Google Launches a Universal Format for Karpathy's LLM Wiki — Techstrong.ai",
      "url": "https://techstrong.ai/articles/google-launches-a-universal-format-for-karpathys-llm-wiki/"
    },
    {
      "@type": "Citation",
      "accessed": "2026-06-28",
      "citationRole": "supports",
      "citationType": "article",
      "title": "Google Just Standardized Karpathy's LLM Wiki Pattern — The Menon Lab",
      "url": "https://themenonlab.blog/blog/google-okf-open-knowledge-format-karpathy-llm-wiki-standard"
    }
  ],
  "conceptType": "semantic",
  "content": "On April 4, 2026, Andrej Karpathy published a GitHub Gist describing the LLM Wiki pattern: instead of re-deriving knowledge from raw documents at query time via Retrieval-Augmented Generation (RAG), an LLM should incrementally build and maintain a persistent, structured wiki composed of interlinked markdown files. The core insight is that LLMs excel at the tedious bookkeeping that causes human wikis to rot — updating cross-references, maintaining consistency, touching fifteen related files in a single pass — while humans curate sources and ask questions. The architecture has three layers: immutable raw sources, an LLM-maintained wiki, and a schema document (CLAUDE.md, AGENTS.md) that configures the LLM's maintenance behavior.\n\nThe gist accumulated 5,000+ stars and 5,000+ forks, spawning a wave of independent implementations: AutoSci, Smriti-MCP, Eidetic, Loremaester, and dozens more, each adding engineering refinements around contradiction detection, token efficiency, and knowledge drift. The Obsidian community quickly built a Karpathy-LLM-wiki plugin. AI startup Nimbalyst automated the bookkeeping layer. The open-source Hermes project adopted the format for internal operations. When Google Cloud launched OKF on June 12, 2026, it explicitly named Karpathy's gist as the foundational pattern it was formalizing.\n\nThis trajectory is significant for the OKF+MIF question in two ways. First, it demonstrates that the practitioner community has already converged on the core architectural bet that OKF encodes: markdown + git + minimal conventions as the packaging layer for AI-agent knowledge. OKF v0.1 did not create this pattern; it captured and standardized existing behavior. Second, the pattern's rapid organic growth validates the demand for an accessible, git-native knowledge format — and simultaneously exposes its current limitation: the community's implementations reveal divergent metadata conventions, untyped links, no shared provenance model, and no temporal validity mechanism. These gaps in the LLM-wiki pattern are precisely the structural problems that MIF's typed relationships, provenance objects, and temporal validity fields exist to solve. The adoption trajectory of the LLM-wiki pattern is thus a direct demand signal for the kind of semantic layering MIF provides on top of OKF's packaging foundation.",
  "created": "2026-06-28T00:00:00Z",
  "modified": "2026-06-28T00:00:00Z",
  "temporal": {
    "@type": "TemporalMetadata",
    "validFrom": "2026-06-28T00:00:00Z"
  },
  "entity": {
    "direction": "increasing",
    "entity_type": "trend",
    "name": "Karpathy's LLM wiki pattern adoption"
  },
  "extensions": {
    "harness": {
      "dimension": "trajectory",
      "gathered_under": "gv-722bb7b64725",
      "verification": {
        "attempted_at": "2026-06-28T12:20:00Z",
        "disconfirming_evidence": [],
        "verdict": "survived",
        "verdict_basis": "Karpathy gist primary source confirms April 4 2026 date, 5000+ stars and 5000+ forks, and the three-layer raw-sources / LLM-maintained-wiki / schema-doc architecture as a RAG alternative; the Google Cloud OKF blog confirms OKF formalizes this pattern. 1 primary fetch plus shared blog; no disconfirmation."
      }
    }
  },
  "namespace": "harness/example-okf-mif-knowledge-spine",
  "ontology": {
    "id": "trend-analysis"
  },
  "provenance": {
    "@type": "Provenance",
    "confidence": 0.9,
    "sourceType": "agent_inferred",
    "trustLevel": "high_confidence"
  },
  "relationships": [
    {
      "strength": 0.9,
      "target": "urn:mif:5239f02b-a66a-50df-a2c4-6da38ed02201",
      "type": "relates-to"
    }
  ],
  "summary": "Andrej Karpathy's April 2026 LLM wiki gist — propose maintaining a git-native, LLM-updated markdown knowledge base rather than re-deriving answers from raw documents via RAG — accumulated 5,000+ stars and spawned dozens of independent implementations within months, establishing git-native structured markdown as the practitioner default for LLM-context persistence.",
  "tags": [
    "karpathy",
    "llm-wiki",
    "git-native",
    "markdown",
    "trajectory",
    "adoption",
    "pattern",
    "open-source",
    "github"
  ],
  "title": "Karpathy's LLM Wiki Pattern: 5,000+ Stars and a Wave of Implementations"
}
