{
  "@context": "https://mif-spec.dev/schema/context.jsonld",
  "@id": "urn:mif:3150363d-ce93-5294-b97a-d105409dfbae",
  "aliases": [
    "urn:mif:concept:harness/example-okf-mif-knowledge-spine:landscape-okf-google-open-knowledge-format"
  ],
  "@type": "Concept",
  "citations": [
    {
      "@type": "Citation",
      "accessed": "2026-06-28",
      "citationRole": "supports",
      "citationType": "article",
      "title": "How the Open Knowledge Format can improve data sharing - Google Cloud Blog",
      "url": "https://cloud.google.com/blog/products/data-analytics/how-the-open-knowledge-format-can-improve-data-sharing"
    },
    {
      "@type": "Citation",
      "accessed": "2026-06-28",
      "citationRole": "supports",
      "citationType": "documentation",
      "title": "OKF Specification v0.1 - GoogleCloudPlatform/knowledge-catalog on GitHub",
      "url": "https://github.com/GoogleCloudPlatform/knowledge-catalog/blob/main/okf/SPEC.md"
    },
    {
      "@type": "Citation",
      "accessed": "2026-06-28",
      "citationRole": "supports",
      "citationType": "article",
      "title": "Google Cloud Introduces Open Knowledge Format (OKF): A Vendor-Neutral Markdown Spec for Giving AI Agents Curated Context - MarkTechPost",
      "url": "https://www.marktechpost.com/2026/06/16/google-cloud-introduces-open-knowledge-format-okf-a-vendor-neutral-markdown-spec-for-giving-ai-agents-curated-context/"
    }
  ],
  "conceptType": "semantic",
  "content": "Google Cloud published Open Knowledge Format v0.1 on June 12, 2026, open-sourcing the specification, reference implementations, and sample bundles under the Apache 2.0 license. OKF represents knowledge as a directory of markdown files with YAML frontmatter — one mandatory field (`type`), six recommended fields (`title`, `description`, `resource`, `tags`, `timestamp`), and unlimited producer-defined extensions. Concepts cross-link via normal markdown links; bundles can include `index.md` for hierarchy and `log.md` for chronological change history.\n\nOKF's three design principles are: (1) minimally opinionated — the spec defines the interoperability surface, not the content model; (2) producer/consumer independence — no shared registry, runtime, or SDK required; (3) format, not platform — vendor-neutral, git-distributable, readable with `cat`, shippable as a tarball.\n\nWhat OKF deliberately omits is precisely what makes it an ideal packaging layer for MIF: there is no formal ontology or type hierarchy, no provenance tracking mechanism (author attribution, lineage, confidence), no typed relationship semantics on links (links carry prose meaning only), no temporal versioning beyond the `timestamp` last-modified field, and no inference or constraint enforcement. These gaps are not defects — they are the spec's stated minimalism. The result is that OKF solves the distribution and authoring problem (git-distributable, human-readable, agent-consumable) while MIF's typed relationships, first-class provenance objects, formal ontologies, and temporal modeling provide the semantic depth OKF does not carry.\n\nOKF's positioning matrix (from the specification): it is NOT a metadata catalog (those require vendor schemas and SDKs), NOT a RAG chunked retrieval system (those re-derive knowledge from raw text), and NOT a proprietary wiki (those require vendor lock-in). Instead it stores curated, version-controlled concepts that AI agents read and update directly — the same 'knowledge spine' use case that a MIF+OKF architecture addresses. OKF v0.1 is explicitly described as a starting point, not a finished standard, and is expected to evolve as producers and consumers collectively learn what knowledge representations agents actually need in practice.",
  "created": "2026-06-28T00:00:00Z",
  "modified": "2026-06-28T00:00:00Z",
  "temporal": {
    "@type": "TemporalMetadata",
    "validFrom": "2026-06-28T00:00:00Z"
  },
  "extensions": {
    "harness": {
      "dimension": "landscape",
      "verification": {
        "verdict": "survived",
        "verdict_basis": "OKF v0.1 existence and design (markdown directory + YAML frontmatter, one mandatory type field, untyped markdown links, index.md/log.md, vendor-neutral, no formal ontology/provenance) corroborated by Google Cloud Blog, MarkTechPost, Search Engine Journal, and the GoogleCloudPlatform/knowledge-catalog SPEC.md; no disconfirming source found.",
        "disconfirming_evidence": [],
        "attempted_at": "2026-06-28T11:42:12Z"
      },
      "gathered_under": "gv-722bb7b64725"
    }
  },
  "provenance": {
    "@type": "Provenance",
    "confidence": 0.95,
    "sourceType": "agent_inferred",
    "trustLevel": "high_confidence"
  },
  "relationships": [
    {
      "strength": 0.6,
      "target": "urn:mif:f62797e1-f125-5283-91c4-0d8aa9df7181",
      "type": "relates-to"
    }
  ],
  "summary": "Google Cloud's OKF v0.1 (June 2026) formalizes the 'LLM wiki' pattern as a vendor-neutral markdown directory spec with YAML frontmatter; its deliberate omission of formal ontology, typed relationships, and provenance creates the exact gap that an OKF+MIF layered spine addresses.",
  "tags": [
    "okf",
    "google-cloud",
    "open-knowledge-format",
    "markdown",
    "ai-agents",
    "knowledge-packaging",
    "landscape",
    "prior-art",
    "minimalism",
    "git-distributable"
  ],
  "title": "OKF (Google Cloud Open Knowledge Format): The Minimalist AI-Agent Knowledge Packaging Spec",
  "ontology": {
    "id": "mif-generic"
  },
  "entity": {
    "name": "OKF (Open Knowledge Format)",
    "entity_type": "technology"
  },
  "namespace": "harness/example-okf-mif-knowledge-spine"
}
